{
  "$schema": "../schemas/level.schema.json",
  "id": "06-waterside",
  "name": "Waterside Bleachworks",
  "order": 6,
  "archetype": "FELL",
  "reputationGate": 3,
  "fee": 1100,
  "shiftMinutes": 120,
  "targetMinutes": 95,
  "structure": {
    "type": "chimney",
    "height": 70.0,
    "baseRadius": 3.2,
    "topRadius": 1.9,
    "profile": "round",
    "batter": [
      {
        "at": 0.0,
        "step": 0.0
      }
    ],
    "bands": [
      {
        "at": 36,
        "type": "iron"
      },
      {
        "at": 48,
        "type": "iron"
      }
    ],
    "cap": "corbelled-oversail",
    "leanDegrees": 0.3,
    "leanBearing": 284,
    "jointGrid": {
      "courseHeight": 0.075,
      "brickLength": 0.225,
      "candidateDensity": 4.0
    },
    "weathering": {
      "sootTo": 0.25,
      "bleachFrom": 0.75,
      "seed": 4471
    }
  },
  "bands": [
    {
      "from": 0.0,
      "to": 18.0,
      "type": "plain",
      "quality": {
        "sound": 0.6,
        "fair": 0.3,
        "perished": 0.1,
        "cracked": 0.0
      }
    },
    {
      "from": 18.0,
      "to": 36.0,
      "type": "ivy",
      "quality": {
        "sound": 0.5,
        "fair": 0.4,
        "perished": 0.1,
        "cracked": 0.0
      },
      "params": {
        "clearTimeSeconds": 3.0,
        "coverage": 0.8
      },
      "note": "Joints must be cleared before they can be tapped. Slow, free, mildly annoying, memorable."
    },
    {
      "from": 36.0,
      "to": 52.0,
      "type": "existing-band",
      "quality": {
        "sound": 0.6,
        "fair": 0.3,
        "perished": 0.1,
        "cracked": 0.0
      },
      "params": {
        "freeAnchors": [
          36.0,
          48.0
        ],
        "freeAnchorRating": 3,
        "mustStripInAct2": true
      }
    },
    {
      "from": 52.0,
      "to": 70.0,
      "type": "wind-band",
      "quality": {
        "sound": 0.55,
        "fair": 0.35,
        "perished": 0.1,
        "cracked": 0.0
      },
      "params": {
        "windMultiplier": 1.5
      }
    }
  ],
  "weather": {
    "windBase": 4.0,
    "windAtHeight": [
      [
        0,
        1.0
      ],
      [
        40,
        1.6
      ],
      [
        70,
        2.1
      ]
    ],
    "gustIntervalSeconds": null,
    "precipitation": "none",
    "ramp": null
  },
  "site": {
    "safeLineDistance": 105,
    "exclusions": [
      {
        "id": "pump_house",
        "bearing": 92,
        "distance": 30,
        "value": 180,
        "catastrophic": false
      },
      {
        "id": "boundary_wall",
        "bearing": 138,
        "distance": 45,
        "value": 60,
        "catastrophic": false
      }
    ],
    "corridor": {
      "fromBearing": 250,
      "toBearing": 320
    },
    "crowd": {
      "distance": 140,
      "size": 20,
      "reactsToFall": true
    },
    "backdrop": "mill-town-river"
  },
  "mission": {
    "type": "FELL",
    "requiredHeightReduction": 0,
    "stripOut": [
      "bands",
      "conductor"
    ],
    "gob": {
      "segments": 32,
      "courses": 4,
      "mortarAsymmetry": null,
      "props": 14,
      "dudPropIndex": null,
      "packingQualityMatters": true,
      "burnSecondsRange": [
        45,
        90
      ]
    }
  },
  "complications": [
    {
      "at": "gob:0.60",
      "type": "groan-intensify"
    },
    {
      "at": "gob:0.85",
      "type": "dust-fall"
    }
  ],
  "scoring": {
    "bonuses": [
      {
        "id": "accuracy_5",
        "condition": "angularError<=5",
        "amount": 400
      },
      {
        "id": "accuracy_15",
        "condition": "angularError<=15 and angularError>5",
        "amount": 150
      },
      {
        "id": "clean_break",
        "condition": "fractureCount>=3 and fractureCount<=4",
        "amount": 80
      },
      {
        "id": "no_collateral",
        "condition": "collateralValue==0",
        "amount": 120
      },
      {
        "id": "before_dark",
        "condition": "shiftRemaining>0",
        "amount": 50
      }
    ],
    "hardFailConditions": []
  },
  "loadoutHint": {
    "ladders": 18,
    "dogs": 40,
    "rope": 3
  },
  "replay": "data/replays/06-waterside-expert.replay",
  "designDoc": "docs/02-levels/level-06-waterside.md"
}
